"First Name","Last Name","Headline","Location","Current Title","Current Company","Email Address","Phone Number","Profile URL","Active Project","Notes","Feedback"
"Vaibhav","Kumar","Software Development Engineer at Amazon | IIT(ISM) Dhanbad","Gurugram","Software Development Engineer ","AMAZON DEVELOPMENT CENTRE (INDIA) PRIVATE LIMITED","kvaibhav3101@gmail.com","+918969645175|8969645175","https://www.linkedin.com/in/vaibhav-kumar-31k","New Job post- SDE-II (uncontacted)","",""
"Vinay","Sharma","Software Development Engineer ","Delhi","Software Development Engineer II","Airtel Payments Bank","vinaysharma31170@yahoo.com","+919650543217","https://www.linkedin.com/in/vinay-sharma-72379046","New Job post- SDE-II (uncontacted)","",""
"Sarthak","Kapoor","Backend Developer at Jugnoo","Noida","Backend Developer","Jugnoo","sarthakk66@gmail.com","+919650207457|+91 9650207457","https://www.linkedin.com/in/sarthak-kapoor-8b0a83155","New Job post- SDE-II (uncontacted)|SDE II (Backend) (potential candidate)","",""
"Manish","Kumar","Software Engineer II at JPMorgan Chase & Co.","Bengaluru","Software Engineer II","JPMorgan Chase & Co.","manishkumar21mk@gmail.com","+919460563642|(+91)-9460563642","https://www.linkedin.com/in/manishkc","New Job post- SDE-II (uncontacted)|SDE II Backend (Remote/Work from home) (potential candidate)","",""
"Aman","Agarwal ","SSE IVY Comptech ( Majorly on Java Tech Stack) | Ex-DBS Bank | Ex- Oracle | Nit DGP Alumni","West Godavari","Senior Software Engineer","Ivy Comptech","amancse2012@gmail.com","+918116889282|+91-8116889282","https://www.linkedin.com/in/aman-agarwal-49911a85","New Job post- SDE-II (uncontacted)","",""
"Prateek","Bajpai","Software Development Engineer","Delhi","Software Engineer","Paytm","prateek.official.1510@gmail.com","+919818461858|9818461858","https://www.linkedin.com/in/prateek-bajpai-18921a12a","New Job post- SDE-II (uncontacted)","",""
"Shikhar","Jaiswal","ML Engineer @Samsung | CSE @IIT Ropar","Delhi","NLP Engineer","Samsung Electronics","2015csb1116@iitrpr.ac.in","+919779995466|+91-977-999-5466","https://www.linkedin.com/in/shikherjaiswal","New Job post- SDE-II (uncontacted)","",""
"Pulkit","Jain","Software Engineer at airtel X Labs","North Delhi","Software Engineer","airtel X Labs","pulkitjain610@gmail.com|610@gmail.com","9871171151|+91 9871171151|98711 71151|+91-9871171151|+919871171151","https://www.linkedin.com/in/pulkitjainn","New Job post- SDE-II (uncontacted)|SDE II Backend (Remote/Work from home) (potential candidate)|SDE II (Backend) (potential candidate)|||||||||||","",""
